{
  "schemaVersion": "angit-request/v1",
  "requestId": "req_review",
  "projectId": "prj_demo",
  "command": "status",
  "options": {
    "format": "json",
    "limit": 100,
    "cursor": {
      "projectId": "prj_demo",
      "authorityIncarnation": "aaaaaaaaaaaaaaaaaaaaaaaaaaaaaaaaaaaaaaaaaaaaaaaaaaaaaaaaaaaaaaaa",
      "afterEventId": 1,
      "snapshotHighWatermark": 1
    }
  }
}
